{
  "id": "00000000-0000-0000-0000-000000000001",
  "title": "Confirm Issue Schema for ENG-75",
  "description": "Validate and codify the issue schema used by Paperclip across teams.",
  "domain": "engineering",
  "event_type": "issue",
  "schema": "issue.v1",
  "routing_path": "/issues/ENG-75/confirm-schema",
  "priority": "medium",
  "status": "in_progress",
  "assignee": "user-ct0",
  "created_at": "2026-04-26T12:00:00Z",
  "updated_at": "2026-04-26T12:00:00Z",
  "attachments": [],
  "comments": [
    {
      "id": "c1",
      "author": "user-ct0",
      "text": "Initial ENG-75 payload for schema confirmation.",
      "created_at": "2026-04-26T12:00:00Z"
    }
  ]
}
